{
  "schema_version": "1.0.0",
  "cve_id": "CVE-0000-0012",
  "nixpkgs_rev": "0000000000000000000000000000000000000000",
  "attr_paths": {
    "libexample": {
      "maintainers": [
        {
          "github": "alice"
        },
        {
          "github": "bob"
        }
      ]
    }
  },
  "replay_critical": true
}