{
  "schema_version": "1.0.0",
  "cve_id": "CVE-2026-0992",
  "nixpkgs_rev": "41afd44087b50e5a7d1d3ea1c13f6fae9f8e6f3e",
  "attr_paths": {
    "libxml2_13": {
      "maintainers": [
        {
          "github": "gepbird",
          "name": "gepbird"
        }
      ]
    }
  },
  "replay_critical": true
}
