{
  "schema_version": "1.0.0",
  "cve_id": "CVE-2025-34451",
  "nixpkgs_rev": "2ca816abfa927119327d4fd6d6c706ee1b7f6097",
  "attr_paths": {
    "proxychains-ng": {
      "maintainers": [
        { "github": "zenithal", "name": "zenithal" },
        { "github": "usertam", "name": "usertam" }
      ]
    }
  },
  "replay_critical": true
}
